{
  "$schema": "http://json-schema.org/draft-04/schema#",
  "id": "http://canopsis.org/patch.json",
  "name": "patch",
  "description": "patch schema for data migration version",

  "links": [
    {
      "href": "#http://canopsis.org/base_schema.json"
    }
  ],

  "type": "object",

  "properties": {

    "add": {
      "type": "object",
      "properties": {
        "op": {
          "type": "string"
        },
        "path": {
          "type": "string"
        },
        "value": {
          "type": "string"
        }
      }
    },

    "replace": {
      "type": "object",
      "properties": {
        "op": {
          "type": "string"
        },
        "path": {
          "type": "string"
        },
        "value": {
          "type": "string"
        }
      }
    },

    "remove": {
      "type": "object",
      "properties": {
        "op": {
          "type": "string"
        },
        "path": {
          "type": "string"
        }
      }
    },

    "copy": {
      "type": "object",
      "properties": {
        "op": {
          "type": "string"
        },
        "from": {
          "type": "string"
        },
        "path": {
          "type": "string"
        }
      }
    },

    "move": {
      "type": "object",
      "properties": {
        "op": {
          "type": "string"
        },
        "from": {
          "type": "string"
        },
        "path": {
          "type": "string"
        }
      }
    }
  }
}